No.     Time           Source                Destination           Protocol Length Info
      1 0.000000000    192.168.32.101        192.168.32.100        TCP      66     49189 → 443 [SYN] Seq=0 Win=8192 Len=0 MSS=1460 WS=4 SACK_PERM

Frame 1: 66 bytes on wire (528 bits), 66 bytes captured (528 bits) on interface eth0, id 0
Ethernet II, Src: PcsCompu_2e:e3:27 (08:00:27:2e:e3:27), Dst: PcsCompu_c7:e1:36 (08:00:27:c7:e1:36)
Internet Protocol Version 4, Src: 192.168.32.101, Dst: 192.168.32.100
Transmission Control Protocol, Src Port: 49189, Dst Port: 443, Seq: 0, Len: 0

No.     Time           Source                Destination           Protocol Length Info
      2 0.000032739    192.168.32.100        192.168.32.101        TCP      66     443 → 49189 [SYN, ACK] Seq=0 Ack=1 Win=64240 Len=0 MSS=1460 SACK_PERM WS=128

Frame 2: 66 bytes on wire (528 bits), 66 bytes captured (528 bits) on interface eth0, id 0
Ethernet II, Src: PcsCompu_c7:e1:36 (08:00:27:c7:e1:36), Dst: PcsCompu_2e:e3:27 (08:00:27:2e:e3:27)
Internet Protocol Version 4, Src: 192.168.32.100, Dst: 192.168.32.101
Transmission Control Protocol, Src Port: 443, Dst Port: 49189, Seq: 0, Ack: 1, Len: 0

No.     Time           Source                Destination           Protocol Length Info
      3 0.000345730    192.168.32.101        192.168.32.100        TCP      60     49189 → 443 [ACK] Seq=1 Ack=1 Win=65700 Len=0

Frame 3: 60 bytes on wire (480 bits), 60 bytes captured (480 bits) on interface eth0, id 0
Ethernet II, Src: PcsCompu_2e:e3:27 (08:00:27:2e:e3:27), Dst: PcsCompu_c7:e1:36 (08:00:27:c7:e1:36)
Internet Protocol Version 4, Src: 192.168.32.101, Dst: 192.168.32.100
Transmission Control Protocol, Src Port: 49189, Dst Port: 443, Seq: 1, Ack: 1, Len: 0

No.     Time           Source                Destination           Protocol Length Info
      4 0.000789946    192.168.32.101        192.168.32.100        TLSv1    215    Client Hello

Frame 4: 215 bytes on wire (1720 bits), 215 bytes captured (1720 bits) on interface eth0, id 0
Ethernet II, Src: PcsCompu_2e:e3:27 (08:00:27:2e:e3:27), Dst: PcsCompu_c7:e1:36 (08:00:27:c7:e1:36)
Internet Protocol Version 4, Src: 192.168.32.101, Dst: 192.168.32.100
Transmission Control Protocol, Src Port: 49189, Dst Port: 443, Seq: 1, Ack: 1, Len: 161
Transport Layer Security

No.     Time           Source                Destination           Protocol Length Info
      5 0.000811027    192.168.32.100        192.168.32.101        TCP      54     443 → 49189 [ACK] Seq=1 Ack=162 Win=64128 Len=0

Frame 5: 54 bytes on wire (432 bits), 54 bytes captured (432 bits) on interface eth0, id 0
Ethernet II, Src: PcsCompu_c7:e1:36 (08:00:27:c7:e1:36), Dst: PcsCompu_2e:e3:27 (08:00:27:2e:e3:27)
Internet Protocol Version 4, Src: 192.168.32.100, Dst: 192.168.32.101
Transmission Control Protocol, Src Port: 443, Dst Port: 49189, Seq: 1, Ack: 162, Len: 0

No.     Time           Source                Destination           Protocol Length Info
      6 0.001846151    192.168.32.100        192.168.32.101        TLSv1    199    Server Hello, Change Cipher Spec, Encrypted Handshake Message

Frame 6: 199 bytes on wire (1592 bits), 199 bytes captured (1592 bits) on interface eth0, id 0
Ethernet II, Src: PcsCompu_c7:e1:36 (08:00:27:c7:e1:36), Dst: PcsCompu_2e:e3:27 (08:00:27:2e:e3:27)
Internet Protocol Version 4, Src: 192.168.32.100, Dst: 192.168.32.101
Transmission Control Protocol, Src Port: 443, Dst Port: 49189, Seq: 1, Ack: 162, Len: 145
Transport Layer Security

No.     Time           Source                Destination           Protocol Length Info
      7 0.002409222    192.168.32.101        192.168.32.100        TLSv1    113    Change Cipher Spec, Encrypted Handshake Message

Frame 7: 113 bytes on wire (904 bits), 113 bytes captured (904 bits) on interface eth0, id 0
Ethernet II, Src: PcsCompu_2e:e3:27 (08:00:27:2e:e3:27), Dst: PcsCompu_c7:e1:36 (08:00:27:c7:e1:36)
Internet Protocol Version 4, Src: 192.168.32.101, Dst: 192.168.32.100
Transmission Control Protocol, Src Port: 49189, Dst Port: 443, Seq: 162, Ack: 146, Len: 59
Transport Layer Security

No.     Time           Source                Destination           Protocol Length Info
      8 0.007346891    PcsCompu_2e:e3:27     Broadcast             ARP      60     Who has 192.168.32.1? Tell 192.168.32.101

Frame 8: 60 bytes on wire (480 bits), 60 bytes captured (480 bits) on interface eth0, id 0
Ethernet II, Src: PcsCompu_2e:e3:27 (08:00:27:2e:e3:27), Dst: Broadcast (ff:ff:ff:ff:ff:ff)
Address Resolution Protocol (request)

No.     Time           Source                Destination           Protocol Length Info
      9 0.044596881    192.168.32.100        192.168.32.101        TCP      54     443 → 49189 [ACK] Seq=146 Ack=221 Win=64128 Len=0

Frame 9: 54 bytes on wire (432 bits), 54 bytes captured (432 bits) on interface eth0, id 0
Ethernet II, Src: PcsCompu_c7:e1:36 (08:00:27:c7:e1:36), Dst: PcsCompu_2e:e3:27 (08:00:27:2e:e3:27)
Internet Protocol Version 4, Src: 192.168.32.100, Dst: 192.168.32.101
Transmission Control Protocol, Src Port: 443, Dst Port: 49189, Seq: 146, Ack: 221, Len: 0

No.     Time           Source                Destination           Protocol Length Info
     10 0.774763419    PcsCompu_2e:e3:27     Broadcast             ARP      60     Who has 192.168.32.1? Tell 192.168.32.101

Frame 10: 60 bytes on wire (480 bits), 60 bytes captured (480 bits) on interface eth0, id 0
Ethernet II, Src: PcsCompu_2e:e3:27 (08:00:27:2e:e3:27), Dst: Broadcast (ff:ff:ff:ff:ff:ff)
Address Resolution Protocol (request)

No.     Time           Source                Destination           Protocol Length Info
     11 1.774761494    PcsCompu_2e:e3:27     Broadcast             ARP      60     Who has 192.168.32.1? Tell 192.168.32.101

Frame 11: 60 bytes on wire (480 bits), 60 bytes captured (480 bits) on interface eth0, id 0
Ethernet II, Src: PcsCompu_2e:e3:27 (08:00:27:2e:e3:27), Dst: Broadcast (ff:ff:ff:ff:ff:ff)
Address Resolution Protocol (request)

No.     Time           Source                Destination           Protocol Length Info
     12 3.137335698    fe80::7d57:907b:118:e548 ff02::1:3             LLMNR    84     Standard query 0x56be A wpad

Frame 12: 84 bytes on wire (672 bits), 84 bytes captured (672 bits) on interface eth0, id 0
Ethernet II, Src: PcsCompu_2e:e3:27 (08:00:27:2e:e3:27), Dst: IPv6mcast_01:00:03 (33:33:00:01:00:03)
Internet Protocol Version 6, Src: fe80::7d57:907b:118:e548, Dst: ff02::1:3
User Datagram Protocol, Src Port: 53696, Dst Port: 5355
Link-local Multicast Name Resolution (query)

No.     Time           Source                Destination           Protocol Length Info
     13 3.137620401    192.168.32.101        224.0.0.252           LLMNR    64     Standard query 0x56be A wpad

Frame 13: 64 bytes on wire (512 bits), 64 bytes captured (512 bits) on interface eth0, id 0
Ethernet II, Src: PcsCompu_2e:e3:27 (08:00:27:2e:e3:27), Dst: IPv4mcast_fc (01:00:5e:00:00:fc)
Internet Protocol Version 4, Src: 192.168.32.101, Dst: 224.0.0.252
User Datagram Protocol, Src Port: 57994, Dst Port: 5355
Link-local Multicast Name Resolution (query)

No.     Time           Source                Destination           Protocol Length Info
     14 3.245177671    fe80::7d57:907b:118:e548 ff02::1:3             LLMNR    84     Standard query 0x56be A wpad

Frame 14: 84 bytes on wire (672 bits), 84 bytes captured (672 bits) on interface eth0, id 0
Ethernet II, Src: PcsCompu_2e:e3:27 (08:00:27:2e:e3:27), Dst: IPv6mcast_01:00:03 (33:33:00:01:00:03)
Internet Protocol Version 6, Src: fe80::7d57:907b:118:e548, Dst: ff02::1:3
User Datagram Protocol, Src Port: 53696, Dst Port: 5355
Link-local Multicast Name Resolution (query)

No.     Time           Source                Destination           Protocol Length Info
     15 3.245498962    192.168.32.101        224.0.0.252           LLMNR    64     Standard query 0x56be A wpad

Frame 15: 64 bytes on wire (512 bits), 64 bytes captured (512 bits) on interface eth0, id 0
Ethernet II, Src: PcsCompu_2e:e3:27 (08:00:27:2e:e3:27), Dst: IPv4mcast_fc (01:00:5e:00:00:fc)
Internet Protocol Version 4, Src: 192.168.32.101, Dst: 224.0.0.252
User Datagram Protocol, Src Port: 57994, Dst Port: 5355
Link-local Multicast Name Resolution (query)

No.     Time           Source                Destination           Protocol Length Info
     16 3.447348283    192.168.32.101        192.168.32.255        NBNS     92     Name query NB WPAD<00>

Frame 16: 92 bytes on wire (736 bits), 92 bytes captured (736 bits) on interface eth0, id 0
Ethernet II, Src: PcsCompu_2e:e3:27 (08:00:27:2e:e3:27), Dst: Broadcast (ff:ff:ff:ff:ff:ff)
Internet Protocol Version 4, Src: 192.168.32.101, Dst: 192.168.32.255
User Datagram Protocol, Src Port: 137, Dst Port: 137
NetBIOS Name Service

No.     Time           Source                Destination           Protocol Length Info
     17 4.198050699    192.168.32.101        192.168.32.255        NBNS     92     Name query NB WPAD<00>

Frame 17: 92 bytes on wire (736 bits), 92 bytes captured (736 bits) on interface eth0, id 0
Ethernet II, Src: PcsCompu_2e:e3:27 (08:00:27:2e:e3:27), Dst: Broadcast (ff:ff:ff:ff:ff:ff)
Internet Protocol Version 4, Src: 192.168.32.101, Dst: 192.168.32.255
User Datagram Protocol, Src Port: 137, Dst Port: 137
NetBIOS Name Service

No.     Time           Source                Destination           Protocol Length Info
     18 4.948812980    192.168.32.101        192.168.32.255        NBNS     92     Name query NB WPAD<00>

Frame 18: 92 bytes on wire (736 bits), 92 bytes captured (736 bits) on interface eth0, id 0
Ethernet II, Src: PcsCompu_2e:e3:27 (08:00:27:2e:e3:27), Dst: Broadcast (ff:ff:ff:ff:ff:ff)
Internet Protocol Version 4, Src: 192.168.32.101, Dst: 192.168.32.255
User Datagram Protocol, Src Port: 137, Dst Port: 137
NetBIOS Name Service

No.     Time           Source                Destination           Protocol Length Info
     19 5.702058806    PcsCompu_2e:e3:27     Broadcast             ARP      60     Who has 192.168.32.1? Tell 192.168.32.101

Frame 19: 60 bytes on wire (480 bits), 60 bytes captured (480 bits) on interface eth0, id 0
Ethernet II, Src: PcsCompu_2e:e3:27 (08:00:27:2e:e3:27), Dst: Broadcast (ff:ff:ff:ff:ff:ff)
Address Resolution Protocol (request)

No.     Time           Source                Destination           Protocol Length Info
     20 6.277371134    PcsCompu_2e:e3:27     Broadcast             ARP      60     Who has 192.168.32.1? Tell 192.168.32.101

Frame 20: 60 bytes on wire (480 bits), 60 bytes captured (480 bits) on interface eth0, id 0
Ethernet II, Src: PcsCompu_2e:e3:27 (08:00:27:2e:e3:27), Dst: Broadcast (ff:ff:ff:ff:ff:ff)
Address Resolution Protocol (request)

No.     Time           Source                Destination           Protocol Length Info
     21 7.277707780    PcsCompu_2e:e3:27     Broadcast             ARP      60     Who has 192.168.32.1? Tell 192.168.32.101

Frame 21: 60 bytes on wire (480 bits), 60 bytes captured (480 bits) on interface eth0, id 0
Ethernet II, Src: PcsCompu_2e:e3:27 (08:00:27:2e:e3:27), Dst: Broadcast (ff:ff:ff:ff:ff:ff)
Address Resolution Protocol (request)

No.     Time           Source                Destination           Protocol Length Info
     22 8.843045493    fe80::7d57:907b:118:e548 ff02::1:3             LLMNR    84     Standard query 0x7ada A wpad

Frame 22: 84 bytes on wire (672 bits), 84 bytes captured (672 bits) on interface eth0, id 0
Ethernet II, Src: PcsCompu_2e:e3:27 (08:00:27:2e:e3:27), Dst: IPv6mcast_01:00:03 (33:33:00:01:00:03)
Internet Protocol Version 6, Src: fe80::7d57:907b:118:e548, Dst: ff02::1:3
User Datagram Protocol, Src Port: 61916, Dst Port: 5355
Link-local Multicast Name Resolution (query)

No.     Time           Source                Destination           Protocol Length Info
     23 8.843277099    192.168.32.101        224.0.0.252           LLMNR    64     Standard query 0x7ada A wpad

Frame 23: 64 bytes on wire (512 bits), 64 bytes captured (512 bits) on interface eth0, id 0
Ethernet II, Src: PcsCompu_2e:e3:27 (08:00:27:2e:e3:27), Dst: IPv4mcast_fc (01:00:5e:00:00:fc)
Internet Protocol Version 4, Src: 192.168.32.101, Dst: 224.0.0.252
User Datagram Protocol, Src Port: 56771, Dst Port: 5355
Link-local Multicast Name Resolution (query)

No.     Time           Source                Destination           Protocol Length Info
     24 8.950145676    fe80::7d57:907b:118:e548 ff02::1:3             LLMNR    84     Standard query 0x7ada A wpad

Frame 24: 84 bytes on wire (672 bits), 84 bytes captured (672 bits) on interface eth0, id 0
Ethernet II, Src: PcsCompu_2e:e3:27 (08:00:27:2e:e3:27), Dst: IPv6mcast_01:00:03 (33:33:00:01:00:03)
Internet Protocol Version 6, Src: fe80::7d57:907b:118:e548, Dst: ff02::1:3
User Datagram Protocol, Src Port: 61916, Dst Port: 5355
Link-local Multicast Name Resolution (query)

No.     Time           Source                Destination           Protocol Length Info
     25 8.950389712    192.168.32.101        224.0.0.252           LLMNR    64     Standard query 0x7ada A wpad

Frame 25: 64 bytes on wire (512 bits), 64 bytes captured (512 bits) on interface eth0, id 0
Ethernet II, Src: PcsCompu_2e:e3:27 (08:00:27:2e:e3:27), Dst: IPv4mcast_fc (01:00:5e:00:00:fc)
Internet Protocol Version 4, Src: 192.168.32.101, Dst: 224.0.0.252
User Datagram Protocol, Src Port: 56771, Dst Port: 5355
Link-local Multicast Name Resolution (query)

No.     Time           Source                Destination           Protocol Length Info
     26 9.153700192    192.168.32.101        192.168.32.255        NBNS     92     Name query NB WPAD<00>

Frame 26: 92 bytes on wire (736 bits), 92 bytes captured (736 bits) on interface eth0, id 0
Ethernet II, Src: PcsCompu_2e:e3:27 (08:00:27:2e:e3:27), Dst: Broadcast (ff:ff:ff:ff:ff:ff)
Internet Protocol Version 4, Src: 192.168.32.101, Dst: 192.168.32.255
User Datagram Protocol, Src Port: 137, Dst Port: 137
NetBIOS Name Service

No.     Time           Source                Destination           Protocol Length Info
     27 9.904268431    192.168.32.101        192.168.32.255        NBNS     92     Name query NB WPAD<00>

Frame 27: 92 bytes on wire (736 bits), 92 bytes captured (736 bits) on interface eth0, id 0
Ethernet II, Src: PcsCompu_2e:e3:27 (08:00:27:2e:e3:27), Dst: Broadcast (ff:ff:ff:ff:ff:ff)
Internet Protocol Version 4, Src: 192.168.32.101, Dst: 192.168.32.255
User Datagram Protocol, Src Port: 137, Dst Port: 137
NetBIOS Name Service

No.     Time           Source                Destination           Protocol Length Info
     28 10.654510536   192.168.32.101        192.168.32.255        NBNS     92     Name query NB WPAD<00>

Frame 28: 92 bytes on wire (736 bits), 92 bytes captured (736 bits) on interface eth0, id 0
Ethernet II, Src: PcsCompu_2e:e3:27 (08:00:27:2e:e3:27), Dst: Broadcast (ff:ff:ff:ff:ff:ff)
Internet Protocol Version 4, Src: 192.168.32.101, Dst: 192.168.32.255
User Datagram Protocol, Src Port: 137, Dst Port: 137
NetBIOS Name Service

No.     Time           Source                Destination           Protocol Length Info
     29 11.407893502   192.168.32.101        192.168.32.100        TLSv1    491    Application Data

Frame 29: 491 bytes on wire (3928 bits), 491 bytes captured (3928 bits) on interface eth0, id 0
Ethernet II, Src: PcsCompu_2e:e3:27 (08:00:27:2e:e3:27), Dst: PcsCompu_c7:e1:36 (08:00:27:c7:e1:36)
Internet Protocol Version 4, Src: 192.168.32.101, Dst: 192.168.32.100
Transmission Control Protocol, Src Port: 49189, Dst Port: 443, Seq: 221, Ack: 146, Len: 437
Transport Layer Security

No.     Time           Source                Destination           Protocol Length Info
     30 11.407926241   192.168.32.100        192.168.32.101        TCP      54     443 → 49189 [ACK] Seq=146 Ack=658 Win=64128 Len=0

Frame 30: 54 bytes on wire (432 bits), 54 bytes captured (432 bits) on interface eth0, id 0
Ethernet II, Src: PcsCompu_c7:e1:36 (08:00:27:c7:e1:36), Dst: PcsCompu_2e:e3:27 (08:00:27:2e:e3:27)
Internet Protocol Version 4, Src: 192.168.32.100, Dst: 192.168.32.101
Transmission Control Protocol, Src Port: 443, Dst Port: 49189, Seq: 146, Ack: 658, Len: 0

No.     Time           Source                Destination           Protocol Length Info
     31 11.409086274   192.168.32.100        192.168.32.101        TLSv1    3467   Application Data

Frame 31: 3467 bytes on wire (27736 bits), 3467 bytes captured (27736 bits) on interface eth0, id 0
Ethernet II, Src: PcsCompu_c7:e1:36 (08:00:27:c7:e1:36), Dst: PcsCompu_2e:e3:27 (08:00:27:2e:e3:27)
Internet Protocol Version 4, Src: 192.168.32.100, Dst: 192.168.32.101
Transmission Control Protocol, Src Port: 443, Dst Port: 49189, Seq: 146, Ack: 658, Len: 3413
Transport Layer Security

No.     Time           Source                Destination           Protocol Length Info
     32 11.409520928   192.168.32.101        192.168.32.100        TCP      60     49189 → 443 [ACK] Seq=658 Ack=3559 Win=65700 Len=0

Frame 32: 60 bytes on wire (480 bits), 60 bytes captured (480 bits) on interface eth0, id 0
Ethernet II, Src: PcsCompu_2e:e3:27 (08:00:27:2e:e3:27), Dst: PcsCompu_c7:e1:36 (08:00:27:c7:e1:36)
Internet Protocol Version 4, Src: 192.168.32.101, Dst: 192.168.32.100
Transmission Control Protocol, Src Port: 49189, Dst Port: 443, Seq: 658, Ack: 3559, Len: 0

No.     Time           Source                Destination           Protocol Length Info
     33 11.411524365   192.168.32.101        192.168.32.100        TLSv1    539    Application Data

Frame 33: 539 bytes on wire (4312 bits), 539 bytes captured (4312 bits) on interface eth0, id 0
Ethernet II, Src: PcsCompu_2e:e3:27 (08:00:27:2e:e3:27), Dst: PcsCompu_c7:e1:36 (08:00:27:c7:e1:36)
Internet Protocol Version 4, Src: 192.168.32.101, Dst: 192.168.32.100
Transmission Control Protocol, Src Port: 49189, Dst Port: 443, Seq: 658, Ack: 3559, Len: 485
Transport Layer Security

No.     Time           Source                Destination           Protocol Length Info
     34 11.411710883   192.168.32.100        192.168.32.101        TLSv1    331    Application Data

Frame 34: 331 bytes on wire (2648 bits), 331 bytes captured (2648 bits) on interface eth0, id 0
Ethernet II, Src: PcsCompu_c7:e1:36 (08:00:27:c7:e1:36), Dst: PcsCompu_2e:e3:27 (08:00:27:2e:e3:27)
Internet Protocol Version 4, Src: 192.168.32.100, Dst: 192.168.32.101
Transmission Control Protocol, Src Port: 443, Dst Port: 49189, Seq: 3559, Ack: 1143, Len: 277
Transport Layer Security

No.     Time           Source                Destination           Protocol Length Info
     35 11.428135282   192.168.32.101        192.168.32.100        TCP      66     49190 → 443 [SYN] Seq=0 Win=8192 Len=0 MSS=1460 WS=4 SACK_PERM

Frame 35: 66 bytes on wire (528 bits), 66 bytes captured (528 bits) on interface eth0, id 0
Ethernet II, Src: PcsCompu_2e:e3:27 (08:00:27:2e:e3:27), Dst: PcsCompu_c7:e1:36 (08:00:27:c7:e1:36)
Internet Protocol Version 4, Src: 192.168.32.101, Dst: 192.168.32.100
Transmission Control Protocol, Src Port: 49190, Dst Port: 443, Seq: 0, Len: 0

No.     Time           Source                Destination           Protocol Length Info
     36 11.428165924   192.168.32.100        192.168.32.101        TCP      66     443 → 49190 [SYN, ACK] Seq=0 Ack=1 Win=64240 Len=0 MSS=1460 SACK_PERM WS=128

Frame 36: 66 bytes on wire (528 bits), 66 bytes captured (528 bits) on interface eth0, id 0
Ethernet II, Src: PcsCompu_c7:e1:36 (08:00:27:c7:e1:36), Dst: PcsCompu_2e:e3:27 (08:00:27:2e:e3:27)
Internet Protocol Version 4, Src: 192.168.32.100, Dst: 192.168.32.101
Transmission Control Protocol, Src Port: 443, Dst Port: 49190, Seq: 0, Ack: 1, Len: 0

No.     Time           Source                Destination           Protocol Length Info
     37 11.428413338   192.168.32.101        192.168.32.100        TCP      60     49190 → 443 [ACK] Seq=1 Ack=1 Win=65700 Len=0

Frame 37: 60 bytes on wire (480 bits), 60 bytes captured (480 bits) on interface eth0, id 0
Ethernet II, Src: PcsCompu_2e:e3:27 (08:00:27:2e:e3:27), Dst: PcsCompu_c7:e1:36 (08:00:27:c7:e1:36)
Internet Protocol Version 4, Src: 192.168.32.101, Dst: 192.168.32.100
Transmission Control Protocol, Src Port: 49190, Dst Port: 443, Seq: 1, Ack: 1, Len: 0

No.     Time           Source                Destination           Protocol Length Info
     38 11.428825944   192.168.32.101        192.168.32.100        TLSv1    215    Client Hello

Frame 38: 215 bytes on wire (1720 bits), 215 bytes captured (1720 bits) on interface eth0, id 0
Ethernet II, Src: PcsCompu_2e:e3:27 (08:00:27:2e:e3:27), Dst: PcsCompu_c7:e1:36 (08:00:27:c7:e1:36)
Internet Protocol Version 4, Src: 192.168.32.101, Dst: 192.168.32.100
Transmission Control Protocol, Src Port: 49190, Dst Port: 443, Seq: 1, Ack: 1, Len: 161
Transport Layer Security

No.     Time           Source                Destination           Protocol Length Info
     39 11.428847416   192.168.32.100        192.168.32.101        TCP      54     443 → 49190 [ACK] Seq=1 Ack=162 Win=64128 Len=0

Frame 39: 54 bytes on wire (432 bits), 54 bytes captured (432 bits) on interface eth0, id 0
Ethernet II, Src: PcsCompu_c7:e1:36 (08:00:27:c7:e1:36), Dst: PcsCompu_2e:e3:27 (08:00:27:2e:e3:27)
Internet Protocol Version 4, Src: 192.168.32.100, Dst: 192.168.32.101
Transmission Control Protocol, Src Port: 443, Dst Port: 49190, Seq: 1, Ack: 162, Len: 0

No.     Time           Source                Destination           Protocol Length Info
     40 11.429663344   192.168.32.100        192.168.32.101        TLSv1    1573   Server Hello, Certificate, Server Hello Done

Frame 40: 1573 bytes on wire (12584 bits), 1573 bytes captured (12584 bits) on interface eth0, id 0
Ethernet II, Src: PcsCompu_c7:e1:36 (08:00:27:c7:e1:36), Dst: PcsCompu_2e:e3:27 (08:00:27:2e:e3:27)
Internet Protocol Version 4, Src: 192.168.32.100, Dst: 192.168.32.101
Transmission Control Protocol, Src Port: 443, Dst Port: 49190, Seq: 1, Ack: 162, Len: 1519
Transport Layer Security

No.     Time           Source                Destination           Protocol Length Info
     41 11.430034224   192.168.32.101        192.168.32.100        TCP      60     49190 → 443 [ACK] Seq=162 Ack=1520 Win=65700 Len=0

Frame 41: 60 bytes on wire (480 bits), 60 bytes captured (480 bits) on interface eth0, id 0
Ethernet II, Src: PcsCompu_2e:e3:27 (08:00:27:2e:e3:27), Dst: PcsCompu_c7:e1:36 (08:00:27:c7:e1:36)
Internet Protocol Version 4, Src: 192.168.32.101, Dst: 192.168.32.100
Transmission Control Protocol, Src Port: 49190, Dst Port: 443, Seq: 162, Ack: 1520, Len: 0

No.     Time           Source                Destination           Protocol Length Info
     42 11.430567242   192.168.32.101        192.168.32.100        TLSv1    636    Client Key Exchange, Change Cipher Spec, Encrypted Handshake Message

Frame 42: 636 bytes on wire (5088 bits), 636 bytes captured (5088 bits) on interface eth0, id 0
Ethernet II, Src: PcsCompu_2e:e3:27 (08:00:27:2e:e3:27), Dst: PcsCompu_c7:e1:36 (08:00:27:c7:e1:36)
Internet Protocol Version 4, Src: 192.168.32.101, Dst: 192.168.32.100
Transmission Control Protocol, Src Port: 49190, Dst Port: 443, Seq: 162, Ack: 1520, Len: 582
Transport Layer Security

No.     Time           Source                Destination           Protocol Length Info
     43 11.440980175   192.168.32.100        192.168.32.101        TLSv1    113    Change Cipher Spec, Encrypted Handshake Message

Frame 43: 113 bytes on wire (904 bits), 113 bytes captured (904 bits) on interface eth0, id 0
Ethernet II, Src: PcsCompu_c7:e1:36 (08:00:27:c7:e1:36), Dst: PcsCompu_2e:e3:27 (08:00:27:2e:e3:27)
Internet Protocol Version 4, Src: 192.168.32.100, Dst: 192.168.32.101
Transmission Control Protocol, Src Port: 443, Dst Port: 49190, Seq: 1520, Ack: 744, Len: 59
Transport Layer Security

No.     Time           Source                Destination           Protocol Length Info
     44 11.445323839   PcsCompu_2e:e3:27     Broadcast             ARP      60     Who has 192.168.32.1? Tell 192.168.32.101

Frame 44: 60 bytes on wire (480 bits), 60 bytes captured (480 bits) on interface eth0, id 0
Ethernet II, Src: PcsCompu_2e:e3:27 (08:00:27:2e:e3:27), Dst: Broadcast (ff:ff:ff:ff:ff:ff)
Address Resolution Protocol (request)

No.     Time           Source                Destination           Protocol Length Info
     45 11.620168416   192.168.32.100        192.168.32.101        TCP      331    [TCP Retransmission] 443 → 49189 [PSH, ACK] Seq=3559 Ack=1143 Win=64128 Len=277

Frame 45: 331 bytes on wire (2648 bits), 331 bytes captured (2648 bits) on interface eth0, id 0
Ethernet II, Src: PcsCompu_c7:e1:36 (08:00:27:c7:e1:36), Dst: PcsCompu_2e:e3:27 (08:00:27:2e:e3:27)
Internet Protocol Version 4, Src: 192.168.32.100, Dst: 192.168.32.101
Transmission Control Protocol, Src Port: 443, Dst Port: 49189, Seq: 3559, Ack: 1143, Len: 277

No.     Time           Source                Destination           Protocol Length Info
     46 11.620765990   192.168.32.101        192.168.32.100        TCP      66     49189 → 443 [ACK] Seq=1143 Ack=3836 Win=65420 Len=0 SLE=3559 SRE=3836

Frame 46: 66 bytes on wire (528 bits), 66 bytes captured (528 bits) on interface eth0, id 0
Ethernet II, Src: PcsCompu_2e:e3:27 (08:00:27:2e:e3:27), Dst: PcsCompu_c7:e1:36 (08:00:27:c7:e1:36)
Internet Protocol Version 4, Src: 192.168.32.101, Dst: 192.168.32.100
Transmission Control Protocol, Src Port: 49189, Dst Port: 443, Seq: 1143, Ack: 3836, Len: 0

No.     Time           Source                Destination           Protocol Length Info
     47 11.648660735   192.168.32.100        192.168.32.101        TCP      113    [TCP Retransmission] 443 → 49190 [PSH, ACK] Seq=1520 Ack=744 Win=64128 Len=59

Frame 47: 113 bytes on wire (904 bits), 113 bytes captured (904 bits) on interface eth0, id 0
Ethernet II, Src: PcsCompu_c7:e1:36 (08:00:27:c7:e1:36), Dst: PcsCompu_2e:e3:27 (08:00:27:2e:e3:27)
Internet Protocol Version 4, Src: 192.168.32.100, Dst: 192.168.32.101
Transmission Control Protocol, Src Port: 443, Dst Port: 49190, Seq: 1520, Ack: 744, Len: 59

No.     Time           Source                Destination           Protocol Length Info
     48 11.649259145   192.168.32.101        192.168.32.100        TCP      66     49190 → 443 [ACK] Seq=744 Ack=1579 Win=65640 Len=0 SLE=1520 SRE=1579

Frame 48: 66 bytes on wire (528 bits), 66 bytes captured (528 bits) on interface eth0, id 0
Ethernet II, Src: PcsCompu_2e:e3:27 (08:00:27:2e:e3:27), Dst: PcsCompu_c7:e1:36 (08:00:27:c7:e1:36)
Internet Protocol Version 4, Src: 192.168.32.101, Dst: 192.168.32.100
Transmission Control Protocol, Src Port: 49190, Dst Port: 443, Seq: 744, Ack: 1579, Len: 0

No.     Time           Source                Destination           Protocol Length Info
     49 12.280282653   PcsCompu_2e:e3:27     Broadcast             ARP      60     Who has 192.168.32.1? Tell 192.168.32.101

Frame 49: 60 bytes on wire (480 bits), 60 bytes captured (480 bits) on interface eth0, id 0
Ethernet II, Src: PcsCompu_2e:e3:27 (08:00:27:2e:e3:27), Dst: Broadcast (ff:ff:ff:ff:ff:ff)
Address Resolution Protocol (request)

No.     Time           Source                Destination           Protocol Length Info
     50 13.281931253   PcsCompu_2e:e3:27     Broadcast             ARP      60     Who has 192.168.32.1? Tell 192.168.32.101

Frame 50: 60 bytes on wire (480 bits), 60 bytes captured (480 bits) on interface eth0, id 0
Ethernet II, Src: PcsCompu_2e:e3:27 (08:00:27:2e:e3:27), Dst: Broadcast (ff:ff:ff:ff:ff:ff)
Address Resolution Protocol (request)

No.     Time           Source                Destination           Protocol Length Info
     51 14.579593173   fe80::7d57:907b:118:e548 ff02::1:3             LLMNR    84     Standard query 0xd309 A wpad

Frame 51: 84 bytes on wire (672 bits), 84 bytes captured (672 bits) on interface eth0, id 0
Ethernet II, Src: PcsCompu_2e:e3:27 (08:00:27:2e:e3:27), Dst: IPv6mcast_01:00:03 (33:33:00:01:00:03)
Internet Protocol Version 6, Src: fe80::7d57:907b:118:e548, Dst: ff02::1:3
User Datagram Protocol, Src Port: 51967, Dst Port: 5355
Link-local Multicast Name Resolution (query)

No.     Time           Source                Destination           Protocol Length Info
     52 14.580125640   192.168.32.101        224.0.0.252           LLMNR    64     Standard query 0xd309 A wpad

Frame 52: 64 bytes on wire (512 bits), 64 bytes captured (512 bits) on interface eth0, id 0
Ethernet II, Src: PcsCompu_2e:e3:27 (08:00:27:2e:e3:27), Dst: IPv4mcast_fc (01:00:5e:00:00:fc)
Internet Protocol Version 4, Src: 192.168.32.101, Dst: 224.0.0.252
User Datagram Protocol, Src Port: 50870, Dst Port: 5355
Link-local Multicast Name Resolution (query)

No.     Time           Source                Destination           Protocol Length Info
     53 14.688074814   fe80::7d57:907b:118:e548 ff02::1:3             LLMNR    84     Standard query 0xd309 A wpad

Frame 53: 84 bytes on wire (672 bits), 84 bytes captured (672 bits) on interface eth0, id 0
Ethernet II, Src: PcsCompu_2e:e3:27 (08:00:27:2e:e3:27), Dst: IPv6mcast_01:00:03 (33:33:00:01:00:03)
Internet Protocol Version 6, Src: fe80::7d57:907b:118:e548, Dst: ff02::1:3
User Datagram Protocol, Src Port: 51967, Dst Port: 5355
Link-local Multicast Name Resolution (query)

No.     Time           Source                Destination           Protocol Length Info
     54 14.688384307   192.168.32.101        224.0.0.252           LLMNR    64     Standard query 0xd309 A wpad

Frame 54: 64 bytes on wire (512 bits), 64 bytes captured (512 bits) on interface eth0, id 0
Ethernet II, Src: PcsCompu_2e:e3:27 (08:00:27:2e:e3:27), Dst: IPv4mcast_fc (01:00:5e:00:00:fc)
Internet Protocol Version 4, Src: 192.168.32.101, Dst: 224.0.0.252
User Datagram Protocol, Src Port: 50870, Dst Port: 5355
Link-local Multicast Name Resolution (query)

No.     Time           Source                Destination           Protocol Length Info
     55 14.891845737   192.168.32.101        192.168.32.255        NBNS     92     Name query NB WPAD<00>

Frame 55: 92 bytes on wire (736 bits), 92 bytes captured (736 bits) on interface eth0, id 0
Ethernet II, Src: PcsCompu_2e:e3:27 (08:00:27:2e:e3:27), Dst: Broadcast (ff:ff:ff:ff:ff:ff)
Internet Protocol Version 4, Src: 192.168.32.101, Dst: 192.168.32.255
User Datagram Protocol, Src Port: 137, Dst Port: 137
NetBIOS Name Service

No.     Time           Source                Destination           Protocol Length Info
     56 15.485430972   fe80::7d57:907b:118:e548 ff02::1:2             DHCPv6   150    Solicit XID: 0x5cb066 CID: 000100012c03297e0800272ee327 

Frame 56: 150 bytes on wire (1200 bits), 150 bytes captured (1200 bits) on interface eth0, id 0
Ethernet II, Src: PcsCompu_2e:e3:27 (08:00:27:2e:e3:27), Dst: IPv6mcast_01:00:02 (33:33:00:01:00:02)
Internet Protocol Version 6, Src: fe80::7d57:907b:118:e548, Dst: ff02::1:2
User Datagram Protocol, Src Port: 546, Dst Port: 547
DHCPv6

No.     Time           Source                Destination           Protocol Length Info
     57 15.640866245   192.168.32.101        192.168.32.255        NBNS     92     Name query NB WPAD<00>

Frame 57: 92 bytes on wire (736 bits), 92 bytes captured (736 bits) on interface eth0, id 0
Ethernet II, Src: PcsCompu_2e:e3:27 (08:00:27:2e:e3:27), Dst: Broadcast (ff:ff:ff:ff:ff:ff)
Internet Protocol Version 4, Src: 192.168.32.101, Dst: 192.168.32.255
User Datagram Protocol, Src Port: 137, Dst Port: 137
NetBIOS Name Service

No.     Time           Source                Destination           Protocol Length Info
     58 16.392152867   192.168.32.101        192.168.32.255        NBNS     92     Name query NB WPAD<00>

Frame 58: 92 bytes on wire (736 bits), 92 bytes captured (736 bits) on interface eth0, id 0
Ethernet II, Src: PcsCompu_2e:e3:27 (08:00:27:2e:e3:27), Dst: Broadcast (ff:ff:ff:ff:ff:ff)
Internet Protocol Version 4, Src: 192.168.32.101, Dst: 192.168.32.255
User Datagram Protocol, Src Port: 137, Dst Port: 137
NetBIOS Name Service

No.     Time           Source                Destination           Protocol Length Info
     59 16.417093753   192.168.32.100        192.168.32.101        TLSv1    91     Encrypted Alert

Frame 59: 91 bytes on wire (728 bits), 91 bytes captured (728 bits) on interface eth0, id 0
Ethernet II, Src: PcsCompu_c7:e1:36 (08:00:27:c7:e1:36), Dst: PcsCompu_2e:e3:27 (08:00:27:2e:e3:27)
Internet Protocol Version 4, Src: 192.168.32.100, Dst: 192.168.32.101
Transmission Control Protocol, Src Port: 443, Dst Port: 49189, Seq: 3836, Ack: 1143, Len: 37
Transport Layer Security

No.     Time           Source                Destination           Protocol Length Info
     60 16.417532767   192.168.32.100        192.168.32.101        TCP      54     443 → 49189 [FIN, ACK] Seq=3873 Ack=1143 Win=64128 Len=0

Frame 60: 54 bytes on wire (432 bits), 54 bytes captured (432 bits) on interface eth0, id 0
Ethernet II, Src: PcsCompu_c7:e1:36 (08:00:27:c7:e1:36), Dst: PcsCompu_2e:e3:27 (08:00:27:2e:e3:27)
Internet Protocol Version 4, Src: 192.168.32.100, Dst: 192.168.32.101
Transmission Control Protocol, Src Port: 443, Dst Port: 49189, Seq: 3873, Ack: 1143, Len: 0

No.     Time           Source                Destination           Protocol Length Info
     61 16.417927403   192.168.32.101        192.168.32.100        TCP      60     49189 → 443 [ACK] Seq=1143 Ack=3874 Win=65384 Len=0

Frame 61: 60 bytes on wire (480 bits), 60 bytes captured (480 bits) on interface eth0, id 0
Ethernet II, Src: PcsCompu_2e:e3:27 (08:00:27:2e:e3:27), Dst: PcsCompu_c7:e1:36 (08:00:27:c7:e1:36)
Internet Protocol Version 4, Src: 192.168.32.101, Dst: 192.168.32.100
Transmission Control Protocol, Src Port: 49189, Dst Port: 443, Seq: 1143, Ack: 3874, Len: 0

No.     Time           Source                Destination           Protocol Length Info
     62 17.145400590   PcsCompu_2e:e3:27     Broadcast             ARP      60     Who has 192.168.32.1? Tell 192.168.32.101

Frame 62: 60 bytes on wire (480 bits), 60 bytes captured (480 bits) on interface eth0, id 0
Ethernet II, Src: PcsCompu_2e:e3:27 (08:00:27:2e:e3:27), Dst: Broadcast (ff:ff:ff:ff:ff:ff)
Address Resolution Protocol (request)

No.     Time           Source                Destination           Protocol Length Info
     63 17.782890179   PcsCompu_2e:e3:27     Broadcast             ARP      60     Who has 192.168.32.1? Tell 192.168.32.101

Frame 63: 60 bytes on wire (480 bits), 60 bytes captured (480 bits) on interface eth0, id 0
Ethernet II, Src: PcsCompu_2e:e3:27 (08:00:27:2e:e3:27), Dst: Broadcast (ff:ff:ff:ff:ff:ff)
Address Resolution Protocol (request)

No.     Time           Source                Destination           Protocol Length Info
     64 18.783173086   PcsCompu_2e:e3:27     Broadcast             ARP      60     Who has 192.168.32.1? Tell 192.168.32.101

Frame 64: 60 bytes on wire (480 bits), 60 bytes captured (480 bits) on interface eth0, id 0
Ethernet II, Src: PcsCompu_2e:e3:27 (08:00:27:2e:e3:27), Dst: Broadcast (ff:ff:ff:ff:ff:ff)
Address Resolution Protocol (request)

No.     Time           Source                Destination           Protocol Length Info
     65 20.286390536   fe80::7d57:907b:118:e548 ff02::1:3             LLMNR    84     Standard query 0xe323 A wpad

Frame 65: 84 bytes on wire (672 bits), 84 bytes captured (672 bits) on interface eth0, id 0
Ethernet II, Src: PcsCompu_2e:e3:27 (08:00:27:2e:e3:27), Dst: IPv6mcast_01:00:03 (33:33:00:01:00:03)
Internet Protocol Version 6, Src: fe80::7d57:907b:118:e548, Dst: ff02::1:3
User Datagram Protocol, Src Port: 54452, Dst Port: 5355
Link-local Multicast Name Resolution (query)

No.     Time           Source                Destination           Protocol Length Info
     66 20.286587260   192.168.32.101        224.0.0.252           LLMNR    64     Standard query 0xe323 A wpad

Frame 66: 64 bytes on wire (512 bits), 64 bytes captured (512 bits) on interface eth0, id 0
Ethernet II, Src: PcsCompu_2e:e3:27 (08:00:27:2e:e3:27), Dst: IPv4mcast_fc (01:00:5e:00:00:fc)
Internet Protocol Version 4, Src: 192.168.32.101, Dst: 224.0.0.252
User Datagram Protocol, Src Port: 59212, Dst Port: 5355
Link-local Multicast Name Resolution (query)

No.     Time           Source                Destination           Protocol Length Info
     67 20.393054834   fe80::7d57:907b:118:e548 ff02::1:3             LLMNR    84     Standard query 0xe323 A wpad

Frame 67: 84 bytes on wire (672 bits), 84 bytes captured (672 bits) on interface eth0, id 0
Ethernet II, Src: PcsCompu_2e:e3:27 (08:00:27:2e:e3:27), Dst: IPv6mcast_01:00:03 (33:33:00:01:00:03)
Internet Protocol Version 6, Src: fe80::7d57:907b:118:e548, Dst: ff02::1:3
User Datagram Protocol, Src Port: 54452, Dst Port: 5355
Link-local Multicast Name Resolution (query)

No.     Time           Source                Destination           Protocol Length Info
     68 20.393323819   192.168.32.101        224.0.0.252           LLMNR    64     Standard query 0xe323 A wpad

Frame 68: 64 bytes on wire (512 bits), 64 bytes captured (512 bits) on interface eth0, id 0
Ethernet II, Src: PcsCompu_2e:e3:27 (08:00:27:2e:e3:27), Dst: IPv4mcast_fc (01:00:5e:00:00:fc)
Internet Protocol Version 4, Src: 192.168.32.101, Dst: 224.0.0.252
User Datagram Protocol, Src Port: 59212, Dst Port: 5355
Link-local Multicast Name Resolution (query)

No.     Time           Source                Destination           Protocol Length Info
     69 20.597590544   192.168.32.101        192.168.32.255        NBNS     92     Name query NB WPAD<00>

Frame 69: 92 bytes on wire (736 bits), 92 bytes captured (736 bits) on interface eth0, id 0
Ethernet II, Src: PcsCompu_2e:e3:27 (08:00:27:2e:e3:27), Dst: Broadcast (ff:ff:ff:ff:ff:ff)
Internet Protocol Version 4, Src: 192.168.32.101, Dst: 192.168.32.255
User Datagram Protocol, Src Port: 137, Dst Port: 137
NetBIOS Name Service

No.     Time           Source                Destination           Protocol Length Info
     70 21.347692575   192.168.32.101        192.168.32.255        NBNS     92     Name query NB WPAD<00>

Frame 70: 92 bytes on wire (736 bits), 92 bytes captured (736 bits) on interface eth0, id 0
Ethernet II, Src: PcsCompu_2e:e3:27 (08:00:27:2e:e3:27), Dst: Broadcast (ff:ff:ff:ff:ff:ff)
Internet Protocol Version 4, Src: 192.168.32.101, Dst: 192.168.32.255
User Datagram Protocol, Src Port: 137, Dst Port: 137
NetBIOS Name Service

No.     Time           Source                Destination           Protocol Length Info
     71 21.410216838   192.168.32.101        192.168.32.100        TCP      60     49189 → 443 [RST, ACK] Seq=1143 Ack=3874 Win=0 Len=0

Frame 71: 60 bytes on wire (480 bits), 60 bytes captured (480 bits) on interface eth0, id 0
Ethernet II, Src: PcsCompu_2e:e3:27 (08:00:27:2e:e3:27), Dst: PcsCompu_c7:e1:36 (08:00:27:c7:e1:36)
Internet Protocol Version 4, Src: 192.168.32.101, Dst: 192.168.32.100
Transmission Control Protocol, Src Port: 49189, Dst Port: 443, Seq: 1143, Ack: 3874, Len: 0

No.     Time           Source                Destination           Protocol Length Info
     72 22.097626079   192.168.32.101        192.168.32.255        NBNS     92     Name query NB WPAD<00>

Frame 72: 92 bytes on wire (736 bits), 92 bytes captured (736 bits) on interface eth0, id 0
Ethernet II, Src: PcsCompu_2e:e3:27 (08:00:27:2e:e3:27), Dst: Broadcast (ff:ff:ff:ff:ff:ff)
Internet Protocol Version 4, Src: 192.168.32.101, Dst: 192.168.32.255
User Datagram Protocol, Src Port: 137, Dst Port: 137
NetBIOS Name Service

No.     Time           Source                Destination           Protocol Length Info
     73 22.852833861   192.168.32.101        192.168.32.100        TCP      60     49190 → 443 [FIN, ACK] Seq=744 Ack=1579 Win=65640 Len=0

Frame 73: 60 bytes on wire (480 bits), 60 bytes captured (480 bits) on interface eth0, id 0
Ethernet II, Src: PcsCompu_2e:e3:27 (08:00:27:2e:e3:27), Dst: PcsCompu_c7:e1:36 (08:00:27:c7:e1:36)
Internet Protocol Version 4, Src: 192.168.32.101, Dst: 192.168.32.100
Transmission Control Protocol, Src Port: 49190, Dst Port: 443, Seq: 744, Ack: 1579, Len: 0

No.     Time           Source                Destination           Protocol Length Info
     74 22.853150224   192.168.32.100        192.168.32.101        TLSv1    91     Encrypted Alert

Frame 74: 91 bytes on wire (728 bits), 91 bytes captured (728 bits) on interface eth0, id 0
Ethernet II, Src: PcsCompu_c7:e1:36 (08:00:27:c7:e1:36), Dst: PcsCompu_2e:e3:27 (08:00:27:2e:e3:27)
Internet Protocol Version 4, Src: 192.168.32.100, Dst: 192.168.32.101
Transmission Control Protocol, Src Port: 443, Dst Port: 49190, Seq: 1579, Ack: 745, Len: 37
Transport Layer Security

No.     Time           Source                Destination           Protocol Length Info
     75 22.853297216   192.168.32.100        192.168.32.101        TCP      54     443 → 49190 [FIN, ACK] Seq=1616 Ack=745 Win=64128 Len=0

Frame 75: 54 bytes on wire (432 bits), 54 bytes captured (432 bits) on interface eth0, id 0
Ethernet II, Src: PcsCompu_c7:e1:36 (08:00:27:c7:e1:36), Dst: PcsCompu_2e:e3:27 (08:00:27:2e:e3:27)
Internet Protocol Version 4, Src: 192.168.32.100, Dst: 192.168.32.101
Transmission Control Protocol, Src Port: 443, Dst Port: 49190, Seq: 1616, Ack: 745, Len: 0

No.     Time           Source                Destination           Protocol Length Info
     76 22.853436365   192.168.32.101        192.168.32.100        TCP      60     49190 → 443 [RST, ACK] Seq=745 Ack=1616 Win=0 Len=0

Frame 76: 60 bytes on wire (480 bits), 60 bytes captured (480 bits) on interface eth0, id 0
Ethernet II, Src: PcsCompu_2e:e3:27 (08:00:27:2e:e3:27), Dst: PcsCompu_c7:e1:36 (08:00:27:c7:e1:36)
Internet Protocol Version 4, Src: 192.168.32.101, Dst: 192.168.32.100
Transmission Control Protocol, Src Port: 49190, Dst Port: 443, Seq: 745, Ack: 1616, Len: 0

No.     Time           Source                Destination           Protocol Length Info
     77 22.853909560   192.168.32.101        192.168.32.100        TCP      60     49190 → 443 [RST] Seq=745 Win=0 Len=0

Frame 77: 60 bytes on wire (480 bits), 60 bytes captured (480 bits) on interface eth0, id 0
Ethernet II, Src: PcsCompu_2e:e3:27 (08:00:27:2e:e3:27), Dst: PcsCompu_c7:e1:36 (08:00:27:c7:e1:36)
Internet Protocol Version 4, Src: 192.168.32.101, Dst: 192.168.32.100
Transmission Control Protocol, Src Port: 49190, Dst Port: 443, Seq: 745, Len: 0

No.     Time           Source                Destination           Protocol Length Info
     78 29.679832325   fe80::a00:27ff:fec7:e136 ff02::2               ICMPv6   70     Router Solicitation from 08:00:27:c7:e1:36

Frame 78: 70 bytes on wire (560 bits), 70 bytes captured (560 bits) on interface eth0, id 0
Ethernet II, Src: PcsCompu_c7:e1:36 (08:00:27:c7:e1:36), Dst: IPv6mcast_02 (33:33:00:00:00:02)
Internet Protocol Version 6, Src: fe80::a00:27ff:fec7:e136, Dst: ff02::2
Internet Control Message Protocol v6

No.     Time           Source                Destination           Protocol Length Info
     79 72.734605863   192.168.32.100        192.168.32.255        NBNS     92     Name query NB WORKGROUP<1d>

Frame 79: 92 bytes on wire (736 bits), 92 bytes captured (736 bits) on interface eth0, id 0
Ethernet II, Src: PcsCompu_c7:e1:36 (08:00:27:c7:e1:36), Dst: Broadcast (ff:ff:ff:ff:ff:ff)
Internet Protocol Version 4, Src: 192.168.32.100, Dst: 192.168.32.255
User Datagram Protocol, Src Port: 44803, Dst Port: 137
NetBIOS Name Service

No.     Time           Source                Destination           Protocol Length Info
     80 72.735138818   PcsCompu_2e:e3:27     Broadcast             ARP      60     Who has 192.168.32.100? Tell 192.168.32.101

Frame 80: 60 bytes on wire (480 bits), 60 bytes captured (480 bits) on interface eth0, id 0
Ethernet II, Src: PcsCompu_2e:e3:27 (08:00:27:2e:e3:27), Dst: Broadcast (ff:ff:ff:ff:ff:ff)
Address Resolution Protocol (request)

No.     Time           Source                Destination           Protocol Length Info
     81 72.735145373   PcsCompu_c7:e1:36     PcsCompu_2e:e3:27     ARP      42     192.168.32.100 is at 08:00:27:c7:e1:36

Frame 81: 42 bytes on wire (336 bits), 42 bytes captured (336 bits) on interface eth0, id 0
Ethernet II, Src: PcsCompu_c7:e1:36 (08:00:27:c7:e1:36), Dst: PcsCompu_2e:e3:27 (08:00:27:2e:e3:27)
Address Resolution Protocol (reply)

No.     Time           Source                Destination           Protocol Length Info
     82 72.735469380   192.168.32.101        192.168.32.100        NBNS     104    Name query response NB 192.168.32.101

Frame 82: 104 bytes on wire (832 bits), 104 bytes captured (832 bits) on interface eth0, id 0
Ethernet II, Src: PcsCompu_2e:e3:27 (08:00:27:2e:e3:27), Dst: PcsCompu_c7:e1:36 (08:00:27:c7:e1:36)
Internet Protocol Version 4, Src: 192.168.32.101, Dst: 192.168.32.100
User Datagram Protocol, Src Port: 137, Dst Port: 44803
NetBIOS Name Service

No.     Time           Source                Destination           Protocol Length Info
     83 72.735685840   192.168.32.100        192.168.32.101        NBNS     92     Name query NBSTAT WORKGROUP<00>

Frame 83: 92 bytes on wire (736 bits), 92 bytes captured (736 bits) on interface eth0, id 0
Ethernet II, Src: PcsCompu_c7:e1:36 (08:00:27:c7:e1:36), Dst: PcsCompu_2e:e3:27 (08:00:27:2e:e3:27)
Internet Protocol Version 4, Src: 192.168.32.100, Dst: 192.168.32.101
User Datagram Protocol, Src Port: 40185, Dst Port: 137
NetBIOS Name Service

No.     Time           Source                Destination           Protocol Length Info
     84 72.735937895   192.168.32.101        192.168.32.100        NBNS     253    Name query response NBSTAT

Frame 84: 253 bytes on wire (2024 bits), 253 bytes captured (2024 bits) on interface eth0, id 0
Ethernet II, Src: PcsCompu_2e:e3:27 (08:00:27:2e:e3:27), Dst: PcsCompu_c7:e1:36 (08:00:27:c7:e1:36)
Internet Protocol Version 4, Src: 192.168.32.101, Dst: 192.168.32.100
User Datagram Protocol, Src Port: 137, Dst Port: 40185
NetBIOS Name Service

No.     Time           Source                Destination           Protocol Length Info
     85 72.736295714   192.168.32.100        192.168.32.255        NBNS     92     Name query NB WINDOWS7<20>

Frame 85: 92 bytes on wire (736 bits), 92 bytes captured (736 bits) on interface eth0, id 0
Ethernet II, Src: PcsCompu_c7:e1:36 (08:00:27:c7:e1:36), Dst: Broadcast (ff:ff:ff:ff:ff:ff)
Internet Protocol Version 4, Src: 192.168.32.100, Dst: 192.168.32.255
User Datagram Protocol, Src Port: 42671, Dst Port: 137
NetBIOS Name Service

No.     Time           Source                Destination           Protocol Length Info
     86 72.736598320   192.168.32.101        192.168.32.100        NBNS     104    Name query response NB 192.168.32.101

Frame 86: 104 bytes on wire (832 bits), 104 bytes captured (832 bits) on interface eth0, id 0
Ethernet II, Src: PcsCompu_2e:e3:27 (08:00:27:2e:e3:27), Dst: PcsCompu_c7:e1:36 (08:00:27:c7:e1:36)
Internet Protocol Version 4, Src: 192.168.32.101, Dst: 192.168.32.100
User Datagram Protocol, Src Port: 137, Dst Port: 42671
NetBIOS Name Service

No.     Time           Source                Destination           Protocol Length Info
     87 72.737313380   192.168.32.100        192.168.32.101        TCP      74     50900 → 139 [SYN] Seq=0 Win=64240 Len=0 MSS=1460 SACK_PERM TSval=2636549499 TSecr=0 WS=128

Frame 87: 74 bytes on wire (592 bits), 74 bytes captured (592 bits) on interface eth0, id 0
Ethernet II, Src: PcsCompu_c7:e1:36 (08:00:27:c7:e1:36), Dst: PcsCompu_2e:e3:27 (08:00:27:2e:e3:27)
Internet Protocol Version 4, Src: 192.168.32.100, Dst: 192.168.32.101
Transmission Control Protocol, Src Port: 50900, Dst Port: 139, Seq: 0, Len: 0

No.     Time           Source                Destination           Protocol Length Info
     88 72.737845683   192.168.32.101        192.168.32.100        TCP      74     139 → 50900 [SYN, ACK] Seq=0 Ack=1 Win=8192 Len=0 MSS=1460 WS=256 SACK_PERM TSval=1331941 TSecr=2636549499

Frame 88: 74 bytes on wire (592 bits), 74 bytes captured (592 bits) on interface eth0, id 0
Ethernet II, Src: PcsCompu_2e:e3:27 (08:00:27:2e:e3:27), Dst: PcsCompu_c7:e1:36 (08:00:27:c7:e1:36)
Internet Protocol Version 4, Src: 192.168.32.101, Dst: 192.168.32.100
Transmission Control Protocol, Src Port: 139, Dst Port: 50900, Seq: 0, Ack: 1, Len: 0

No.     Time           Source                Destination           Protocol Length Info
     89 72.737860398   192.168.32.100        192.168.32.101        TCP      66     50900 → 139 [ACK] Seq=1 Ack=1 Win=64256 Len=0 TSval=2636549500 TSecr=1331941

Frame 89: 66 bytes on wire (528 bits), 66 bytes captured (528 bits) on interface eth0, id 0
Ethernet II, Src: PcsCompu_c7:e1:36 (08:00:27:c7:e1:36), Dst: PcsCompu_2e:e3:27 (08:00:27:2e:e3:27)
Internet Protocol Version 4, Src: 192.168.32.100, Dst: 192.168.32.101
Transmission Control Protocol, Src Port: 50900, Dst Port: 139, Seq: 1, Ack: 1, Len: 0

No.     Time           Source                Destination           Protocol Length Info
     90 72.738204394   192.168.32.100        192.168.32.101        NBSS     138    Session request, to WINDOWS7<20> from KALI<00>

Frame 90: 138 bytes on wire (1104 bits), 138 bytes captured (1104 bits) on interface eth0, id 0
Ethernet II, Src: PcsCompu_c7:e1:36 (08:00:27:c7:e1:36), Dst: PcsCompu_2e:e3:27 (08:00:27:2e:e3:27)
Internet Protocol Version 4, Src: 192.168.32.100, Dst: 192.168.32.101
Transmission Control Protocol, Src Port: 50900, Dst Port: 139, Seq: 1, Ack: 1, Len: 72
NetBIOS Session Service

No.     Time           Source                Destination           Protocol Length Info
     91 72.738635919   192.168.32.101        192.168.32.100        NBSS     70     Positive session response

Frame 91: 70 bytes on wire (560 bits), 70 bytes captured (560 bits) on interface eth0, id 0
Ethernet II, Src: PcsCompu_2e:e3:27 (08:00:27:2e:e3:27), Dst: PcsCompu_c7:e1:36 (08:00:27:c7:e1:36)
Internet Protocol Version 4, Src: 192.168.32.101, Dst: 192.168.32.100
Transmission Control Protocol, Src Port: 139, Dst Port: 50900, Seq: 1, Ack: 73, Len: 4
NetBIOS Session Service

No.     Time           Source                Destination           Protocol Length Info
     92 72.738647576   192.168.32.100        192.168.32.101        TCP      66     50900 → 139 [ACK] Seq=73 Ack=5 Win=64256 Len=0 TSval=2636549501 TSecr=1331941

Frame 92: 66 bytes on wire (528 bits), 66 bytes captured (528 bits) on interface eth0, id 0
Ethernet II, Src: PcsCompu_c7:e1:36 (08:00:27:c7:e1:36), Dst: PcsCompu_2e:e3:27 (08:00:27:2e:e3:27)
Internet Protocol Version 4, Src: 192.168.32.100, Dst: 192.168.32.101
Transmission Control Protocol, Src Port: 50900, Dst Port: 139, Seq: 73, Ack: 5, Len: 0

No.     Time           Source                Destination           Protocol Length Info
     93 72.738921814   192.168.32.100        192.168.32.101        SMB      132    Negotiate Protocol Request

Frame 93: 132 bytes on wire (1056 bits), 132 bytes captured (1056 bits) on interface eth0, id 0
Ethernet II, Src: PcsCompu_c7:e1:36 (08:00:27:c7:e1:36), Dst: PcsCompu_2e:e3:27 (08:00:27:2e:e3:27)
Internet Protocol Version 4, Src: 192.168.32.100, Dst: 192.168.32.101
Transmission Control Protocol, Src Port: 50900, Dst Port: 139, Seq: 73, Ack: 5, Len: 66
NetBIOS Session Service
SMB (Server Message Block Protocol)

No.     Time           Source                Destination           Protocol Length Info
     94 72.739988636   192.168.32.101        192.168.32.100        SMB      197    Negotiate Protocol Response

Frame 94: 197 bytes on wire (1576 bits), 197 bytes captured (1576 bits) on interface eth0, id 0
Ethernet II, Src: PcsCompu_2e:e3:27 (08:00:27:2e:e3:27), Dst: PcsCompu_c7:e1:36 (08:00:27:c7:e1:36)
Internet Protocol Version 4, Src: 192.168.32.101, Dst: 192.168.32.100
Transmission Control Protocol, Src Port: 139, Dst Port: 50900, Seq: 5, Ack: 139, Len: 131
NetBIOS Session Service
SMB (Server Message Block Protocol)

No.     Time           Source                Destination           Protocol Length Info
     95 72.746131876   192.168.32.100        192.168.32.101        SMB      226    Session Setup AndX Request, NTLMSSP_NEGOTIATE

Frame 95: 226 bytes on wire (1808 bits), 226 bytes captured (1808 bits) on interface eth0, id 0
Ethernet II, Src: PcsCompu_c7:e1:36 (08:00:27:c7:e1:36), Dst: PcsCompu_2e:e3:27 (08:00:27:2e:e3:27)
Internet Protocol Version 4, Src: 192.168.32.100, Dst: 192.168.32.101
Transmission Control Protocol, Src Port: 50900, Dst Port: 139, Seq: 139, Ack: 136, Len: 160
NetBIOS Session Service
SMB (Server Message Block Protocol)

No.     Time           Source                Destination           Protocol Length Info
     96 72.747120832   192.168.32.101        192.168.32.100        SMB      452    Session Setup AndX Response, NTLMSSP_CHALLENGE, Error: STATUS_MORE_PROCESSING_REQUIRED

Frame 96: 452 bytes on wire (3616 bits), 452 bytes captured (3616 bits) on interface eth0, id 0
Ethernet II, Src: PcsCompu_2e:e3:27 (08:00:27:2e:e3:27), Dst: PcsCompu_c7:e1:36 (08:00:27:c7:e1:36)
Internet Protocol Version 4, Src: 192.168.32.101, Dst: 192.168.32.100
Transmission Control Protocol, Src Port: 139, Dst Port: 50900, Seq: 136, Ack: 299, Len: 386
NetBIOS Session Service
SMB (Server Message Block Protocol)

No.     Time           Source                Destination           Protocol Length Info
     97 72.747392362   192.168.32.100        192.168.32.101        SMB      264    Session Setup AndX Request, NTLMSSP_AUTH, User: \

Frame 97: 264 bytes on wire (2112 bits), 264 bytes captured (2112 bits) on interface eth0, id 0
Ethernet II, Src: PcsCompu_c7:e1:36 (08:00:27:c7:e1:36), Dst: PcsCompu_2e:e3:27 (08:00:27:2e:e3:27)
Internet Protocol Version 4, Src: 192.168.32.100, Dst: 192.168.32.101
Transmission Control Protocol, Src Port: 50900, Dst Port: 139, Seq: 299, Ack: 522, Len: 198
NetBIOS Session Service
SMB (Server Message Block Protocol)

No.     Time           Source                Destination           Protocol Length Info
     98 72.748633066   192.168.32.101        192.168.32.100        SMB      262    Session Setup AndX Response

Frame 98: 262 bytes on wire (2096 bits), 262 bytes captured (2096 bits) on interface eth0, id 0
Ethernet II, Src: PcsCompu_2e:e3:27 (08:00:27:2e:e3:27), Dst: PcsCompu_c7:e1:36 (08:00:27:c7:e1:36)
Internet Protocol Version 4, Src: 192.168.32.101, Dst: 192.168.32.100
Transmission Control Protocol, Src Port: 139, Dst Port: 50900, Seq: 522, Ack: 497, Len: 196
NetBIOS Session Service
SMB (Server Message Block Protocol)

No.     Time           Source                Destination           Protocol Length Info
     99 72.748849827   192.168.32.100        192.168.32.101        SMB      152    Tree Connect AndX Request, Path: \\WINDOWS7\IPC$

Frame 99: 152 bytes on wire (1216 bits), 152 bytes captured (1216 bits) on interface eth0, id 0
Ethernet II, Src: PcsCompu_c7:e1:36 (08:00:27:c7:e1:36), Dst: PcsCompu_2e:e3:27 (08:00:27:2e:e3:27)
Internet Protocol Version 4, Src: 192.168.32.100, Dst: 192.168.32.101
Transmission Control Protocol, Src Port: 50900, Dst Port: 139, Seq: 497, Ack: 718, Len: 86
NetBIOS Session Service
SMB (Server Message Block Protocol)

No.     Time           Source                Destination           Protocol Length Info
    100 72.749600691   192.168.32.101        192.168.32.100        SMB      126    Tree Connect AndX Response

Frame 100: 126 bytes on wire (1008 bits), 126 bytes captured (1008 bits) on interface eth0, id 0
Ethernet II, Src: PcsCompu_2e:e3:27 (08:00:27:2e:e3:27), Dst: PcsCompu_c7:e1:36 (08:00:27:c7:e1:36)
Internet Protocol Version 4, Src: 192.168.32.101, Dst: 192.168.32.100
Transmission Control Protocol, Src Port: 139, Dst Port: 50900, Seq: 718, Ack: 583, Len: 60
NetBIOS Session Service
SMB (Server Message Block Protocol)

No.     Time           Source                Destination           Protocol Length Info
    101 72.749969195   192.168.32.100        192.168.32.101        LANMAN   198    NetServerEnum2 Request, Server, SQL Server, Domain Controller, Backup Controller, Time Source, Apple Server, Novell Server, Domain Member Server, Print Queue Server, Dialin Server, Xenix Server, NT Workstation, Windows for Workgroups, Unknown server type:14, NT Server

Frame 101: 198 bytes on wire (1584 bits), 198 bytes captured (1584 bits) on interface eth0, id 0
Ethernet II, Src: PcsCompu_c7:e1:36 (08:00:27:c7:e1:36), Dst: PcsCompu_2e:e3:27 (08:00:27:2e:e3:27)
Internet Protocol Version 4, Src: 192.168.32.100, Dst: 192.168.32.101
Transmission Control Protocol, Src Port: 50900, Dst Port: 139, Seq: 583, Ack: 778, Len: 132
NetBIOS Session Service
SMB (Server Message Block Protocol)
SMB Pipe Protocol
Microsoft Windows Lanman Remote API Protocol

No.     Time           Source                Destination           Protocol Length Info
    102 72.753182458   192.168.32.101        192.168.32.100        LANMAN   161    NetServerEnum2 Response

Frame 102: 161 bytes on wire (1288 bits), 161 bytes captured (1288 bits) on interface eth0, id 0
Ethernet II, Src: PcsCompu_2e:e3:27 (08:00:27:2e:e3:27), Dst: PcsCompu_c7:e1:36 (08:00:27:c7:e1:36)
Internet Protocol Version 4, Src: 192.168.32.101, Dst: 192.168.32.100
Transmission Control Protocol, Src Port: 139, Dst Port: 50900, Seq: 778, Ack: 715, Len: 95
NetBIOS Session Service
SMB (Server Message Block Protocol)
SMB Pipe Protocol
Microsoft Windows Lanman Remote API Protocol

No.     Time           Source                Destination           Protocol Length Info
    103 72.796459790   192.168.32.100        192.168.32.101        TCP      66     50900 → 139 [ACK] Seq=715 Ack=873 Win=64128 Len=0 TSval=2636549558 TSecr=1331943

Frame 103: 66 bytes on wire (528 bits), 66 bytes captured (528 bits) on interface eth0, id 0
Ethernet II, Src: PcsCompu_c7:e1:36 (08:00:27:c7:e1:36), Dst: PcsCompu_2e:e3:27 (08:00:27:2e:e3:27)
Internet Protocol Version 4, Src: 192.168.32.100, Dst: 192.168.32.101
Transmission Control Protocol, Src Port: 50900, Dst Port: 139, Seq: 715, Ack: 873, Len: 0

No.     Time           Source                Destination           Protocol Length Info
    104 77.808751021   PcsCompu_c7:e1:36     PcsCompu_2e:e3:27     ARP      42     Who has 192.168.32.101? Tell 192.168.32.100

Frame 104: 42 bytes on wire (336 bits), 42 bytes captured (336 bits) on interface eth0, id 0
Ethernet II, Src: PcsCompu_c7:e1:36 (08:00:27:c7:e1:36), Dst: PcsCompu_2e:e3:27 (08:00:27:2e:e3:27)
Address Resolution Protocol (request)

No.     Time           Source                Destination           Protocol Length Info
    105 77.809767842   PcsCompu_2e:e3:27     PcsCompu_c7:e1:36     ARP      60     192.168.32.101 is at 08:00:27:2e:e3:27

Frame 105: 60 bytes on wire (480 bits), 60 bytes captured (480 bits) on interface eth0, id 0
Ethernet II, Src: PcsCompu_2e:e3:27 (08:00:27:2e:e3:27), Dst: PcsCompu_c7:e1:36 (08:00:27:c7:e1:36)
Address Resolution Protocol (reply)
